,Comentario,Score
350,"Lindo el hotel, algo descuidado por mantenimiento le hace falta actualizar todas sus habitaciones me tocó una habitación con alfombra estaba un poco desgradable, no funcionó la tv me cambiaron a una remodelada ahí estaba todo bien la camarista coco muy amable la habitación mejor que la anterior y pues mi recomendación es que renodelen todos las habitaciones para cuando regrese no me toque una habitación con alfombra en serio huelen a humedad, de toda mi estancia fue agradable la señorita esmeralda muy amable y atenta",5
351,"Excelente opcion a un precio justo pues todo el personal siempre al pendiente, muy amables en el trato y servicio en especial ala señorita Amanda muchas gracias por sus atenciones yo si lo recomiendo me gustaron mucho sus habitaciones",5
352,"Llegue a este hotel por que esta en la zona centro , y me queda muy cerca los lugares turísticos de nuevo león. Cuando llegue alas 2 pm mi habitación aun no estaba lista, me la entregaron alas 3 en lo que espere un rato el joven alex de recepción me ofreció un vaso de agua muy rica me sorprendieron al darme mi habitacion .. Cuando subí la señora coco muy amable al entrar ala habitación me encuentro con una tina de hielos acompañado de un refresco en serio con el calor que hace en nuevo león se los agradecí mucho la señorita Amanda muy atenta preguntándome siempre lo que me hacia falta, en toda la estancia estuve muy cómodo solo me queda decir ""gracias hotel misión y sigan así felicidades por el servicio",5
353,"Todo bonito sobre todo la ubicación super cercas, agradecidos por el joven Isidro y Fernando caballero super atentos en todo agradezco por todas sus atenciones regresaré pronto solo para mejorar seria en el clima porque porque con esta calor está súper tenso en las habitaciones. Gracias por todo",5
354,Bueno en mi opinión la recepción le falta mucho pero restaurante muy bien kendy nos sugirió algo de comer ya que soy muy especial las sábanas picaba solo eso y la comida más variedad ya que pues a mi amablemente la señorita kendy me preparo algo a mi gusto más a si me gusto el servicio por eso lo recomiendo,5
355,Exelente atención del mesero freiri muy atento a la nesecida del cliente.los demás meseros deben trabajar en su vocabulario y posturas la comida deliciosa sólo falto más velocidad de parte de la cosina pero por la cantidad de jente que avía es aceptable. super recomendable,5
356,excelente atención del personal de meseros en especial la de el mesero FREIRI trabajamos en una sucursal bancaria cercana a su hotel todos los días desayunamos en este establecimiento debido a que el joven se toma el tiempo de recordar el nombre de sus clientes y siempre con una sonrisa. asiéndonos pasar un inicio de día muy agradable sigan asi,5
357,"El personal de ventas que organizo el evento fue excelente Yessica Gonzalez siempre atenta, satisfaciendo nuestras necesidades, el personal de recepción siempre orientandonos a visitar los puntos de interés y el personal de restaurante Javier Hernández y el Cheff siempre atentos para que todo estuviera a tiempo. En general la calidez del personal fue muy buena, las habitaciones muy limpias y acogedoras. Muy recomendable.",4
358,"Todo estuvo mal, llegamos y la mayoria de la gente en el lobby eran hombres que iban con la intencion de cruzar la frontera y ese era su hotel de paso, el elevador era un asco, lo compartes con el carrito de la limpieza y si tienes suerte bajas al sotano donde recibes un golpe de calor y un aroma a basurero, todo el hotel huele a humedad, nos cambiamos de habitacion, pues la primera era imposible aguantar el olor, y los cojines aun peor; la segunda estaba un poco mejor el olor pero seguia sucia y hasta encontramos una cucaracha, si vas en familia o de vacaciones definitivamente esta no es opcion. ALEJATE!!",1
359,"Se supone que el check-in que se realiza es a partir las 3pm y la habitación aun no estaba lista sino hasta las 6pm. Llevábamos trajes y vestidos para un evento al día siguiente por la mañana, ademas de algunas cajas con accesorios, el elevador no funcionaba y en toda la noche no funcionó, las habitaciones estaban en el piso 7 y 8, ademas de que solo nos contestaban que en 5 minutos reparaban el elevador, sin éxito, no existe comunicación entre el personal, debido a que reportamos que no servía la persiana y enviaron a la camarera a que nos atendiera sin tener idea a que iba, no se solucionó, se fue la luz en del cuarto por 30 minutos, es un mes caluroso así que en ese lapso no había clima.",2
360,La ubicación del hotel es excelente ya que se encuentra en pleno centro de la ciudad de Monterrey y puedes llegar caminando a la macro plaza y dar un recorrido en el centro sin necesidad de utilizar transporte. Más que excelente.,5
361,"Sin duda alguna, el plus de la cadena de valor de este hotel está basado en su gente! Deseo hacer extensivas mis felicitaciones en específico a Javier Hernández del área de Restaurante, quien atendió con calidad y actitud de manera eficiente y eficaz. Excepción que salvo el hecho de que el hotel no tenga áreas deportivas. Saludos!",4
362,"La habitación muy sucia, el aire acondicionado inservible en un mes muy caluroso. Aunque todo fue reportado y fueron a revisar jamás hubo una solución real. Habitación amplia, sin embargo descuidada al igual que el hotel. Jamás llegó mi servicio de restaurante. Ya me había hospedado en varias ocasiones y me parecía buena opción, ahora no quisiera volver a este hotel.",2
363,todo es maravilloso bien ubicado habitaciones amplias comodas la atencion al huesped se percibe desde la llegada. asi mismo el restaurante la atencion y la limpieza y sabor de los alimentos de lo mejor,5
364,"Tuve la fortuna de poder elegir este maravilloso recinto para una exposición de negocios, el cual resulto ser vastante placentero ya que las atenciones brindadas fueron de exelente calidad. amabilidad y cortecia nos rodearon para realizar nuestra exposición al 100% Gracias Jessica gonzalez por tan exelente servicio. Ing. Rodrigo Álvarez y HappyJapan gracias totales",5
365,"Vengo de paseo por la ciudad El hotel esta en el centro de monterrey Las habitaciones cómodas y limpias el aire un poco caliente por el clima de monterrey ,se siente mucho calor ojala arreglen eso. El personal muy amable gracias a todos los colaboradores en especial la señorita Amanda q siempre nos brinda un buen servicio nos a ayudado en todo momento saludos",5
366,"Gracias a hotel misión, desde que llegué me han atendido muy bien. Desde recepcion con el joven Alex y el joven Isidro que me han atendido muy bien la señora de limpieza y la señorita Amanda .. el hotel está en pleno centro de la ciudad y esta muy acogedor saludos"" desde Mazatlán",5
367,"Estoy hospedado aquí desde hace un mes por trabajo y la verdad el hotel está muy agradable, habitaciones limpias personal muy bien capacitado , solo como comentario para mejorar , arreglen los climas hace mucho calor y si estaría muy bien tener más fresca la habitación, saludos ala camarista luz que nos limpia la habitación todos los días y ala señorita Amanda por ayudarnos en todo momento",5
368,Execelente hotel' todo el personal atentos y amables Sobre todo la srta Amanda la supervisora bien amable Proximanete regresare a este lindo hotel misión Monterrey Saludos desde Mayarit Sólo para mejorar en todo es el clima Saludos,5
369,"Hotel misión es muy agradable, las habitaciones muy limpias, los empleados muy amables están disponibles para ayudarte en lo que necesites , saludos ala señorita Amanda y al joven Isidro que nos ayudaron en toda la estancia ""gracias""",5
370,"Excelente!! Servicio de parte de la señorita Reyna y el hotel bien ubicado cerca de todo Y el desayuno bufete riquísimo gran variedad de alimentos, las habitaciones amplias y con todo lo necesario Gracias!!!",5
371,"Mision Monterrey, es buen Hotel para hospedarse varios días ya que cuenta con un ambiente de personal muy amable habitaciones del piso 8 muy limpias la comida del restaurant está rica , gracias al joven Alex de recepción y la señorita Amanda de limpieza que fueron muy amables al ayudarme , Hotel recomendable Saludos y gracias!!",5
372,"Buen hotel Excelente ubicación Lo primero que hice fue ir a comer, el bufete muy rico, Después subí a la habitación , también muy limpia, la señora socorro de limpieza muy amable al igual que el joven Isidro les agradezco la estancia regreso pronto !!!!",5
373,"Es un hotel muy agradable y cómodo, esperamos regresar el otro año también muy buen servicio de el joven Alex y la señorita Reyna de recepcion, recomendable el hotel, ademas pienso que tienen un ambiente muy familiar",5
374,Excelente trato las habitaciones muy limpias. Muy buen trato y amabilidad de parte de adriana siempre muy atenta en sus labores al igual recepción todo muy bien fue muy buena estancia se los recomiendo,5
375,Hotel muy bueno habitacion muy limpia gracias ala señorita reyna y al joven alex de resepcion que fueron muy amables y tambien por la ayuda de la señorita amanda les agradezco mucho su atencion regreso muy pronto,5
376,"Casi siempre vengo.a monterrey por negocios y es la primera que me hospedo En este hotel , cinceramente no me lo recomendaban pero decidi. A arriesgarme ya que el hotel esta muy centrico. Y cerca de donde voy. al llegar, me encontre Con un personal Muy amable desde recepcion con la señorita reyna y la ayuda de la supervisora Amanda. Regresare muy pronto gracias!!",5
377,Hotel bueno esta en la zona centro habitaciones cencillas pero limpias.. los felicito por el personal que tienen son muy atentos... Les recomiendo que le den mantenimiento a los climas la verdad hace mucho calor en monterrey y lo que uno quiere es descansar rico.. en todo lo demas esta muy bien gracias a la señora Amanda por ayudarnos saludos!!,5
378,Buen servicio de todo el personal sobre la srta Adriana muy amable Solo como comentario es mejorar el clima ya que con esta calor no se soporta con los grados que se vive en Monterrey Saludos desde puebla.,5
379,Buen hotel buena ubicacion esta en la zona centro... lo unico que no me gusto es que aqui en monterrey hace mucho calor y el clina de mi habitacion no funcianaba muy bien ya son dos veces que vengo aqui a este hotel gracias ala señorita amanda por atudarme a estar comodo en la habitacion..,4
380,"Llegué el lunes por la mañana habitacion muy limpia fui a restaurant a desayunar, la comida del bufet muy rica lo que no me gustó fue que solo hay un elevador. Exelente personal sobre todo la señorita Amanda que es muy atenta , cuando vuelva regresaré a este hotel",5
381,Vengo por trabajo Y la verdad la atención del personal es muy buena y gracias a la señorita Amanda que me ayudó con la habitación ella es muy atenta gracias el clima no funcionó y le dio rapidez alas cosas recomendable,5
382,Todo bonito. Buen servicio Sobre todo la limpieza todo en orden. Gracias A la srta supervisora Amanda muy amable y atenta En general bien el restaurante y en la zona de Recepción Regreso muy pronto Saludos desde Tlaxcala,5
383,Excelente hotel muy bonito El joven isidro muy amable Bonita las habitaciones y limpieza Gracias Regresaremos Restaurants to do lindo Chicas reception bien Camas muy Rico Instalaciones bien Saludos Para todos,5
384,"Agradecimiento a los que laboran en el Hotel en especial a Isidro Mil por su amable atención y todos los que laboran en el mismo la ubicacion excelente y el Bufette, muy buen ambiente cuentancon musica en vivo",5
385,Mi experiencia fue decepcionante. Calor de arriba de 25-30 grados y sin aire acondicionado y con un olor a humedad en la habitación... Lo unico rescatable fue la atención del personal y q esta muy bien ubicado...,3
386,"Se que los Mision es un ""volado"" pero este si ""se volo la barda"". Habitacion 417 sucia, almohadas con cabellos, no habia toallas (y cuando las llevaron todas deshilachadas), las lamparas de la habitación ha veces no encendian, la cortina del baño deplorable y ya en general los elevadores no servian y el clima no enfriaba... Triste experiencia por la tarifa ofrecida.",2
387,"Era el único hotel que tenía disponibilidad para la fecha que quería; deje equipaje y salí a trabajar cuando entré a mi habitación a la media noche la cama estaba sin tender, la alfombra muy sucia, el piso de la regadera sucio, no había jabón de manos, basura atrás del Buró, toallas rotas. Tuve que reportar a recepción y tomaron fotos del estado me ofrecieron cambio de habitación a esa hora pero estaba igual de mal aseada, reporte a redes sociales y al dia siguiente la gerencia me cambio de piso pero me despertó temprano el ruido de remodelaciones y el personal en el pasillo. El personal no está capacitado para dar solución al huésped, el costo valor precio no vale la pena, hay mejores hoteles alrededor si pueden evitar este hotel, háganlo. NO LO RECOMIENDO EN NINGÚN SENTIDO",1
388,"Hoteles Misión te garantizan el mismo confort, al menos a la alza y no a la baja, en cualquier de sus establecimientos. Lamento compartir que mi experiencia en este hotel fue terrible, al llega a mi habitación me encontré con un aire acondicionado que hacie un ruido terrible, y era aguantar el calor o el ruido, los muebles estaban llenos de polvo y pelo, literalmente había pelo en la mesa de noche y en el lavabo, que ademas se encontraba roto y descuidado, la regadera estaba sucia, había una rendija pegada en la pared que daba a las tuberías, y lo se por que esta rendija estaba rota, lo peor es que no tuve agua caliente durante mi estancia. El Internet es libre hasta cierto punto, si quieres usa tu canal de netflix, o cualquier otro similar TIENES QUE PAGAR UN EXTRA para que te",1
389,Llegué al hotel y no tenían mi reserva por error estaba en otro hotel pero gracias a la srta Verónica me ayudó a localizarla en fin me quedé ya que me gustó el hotel y más que nada la atención que me brindaron al llegar.,4
390,"La verdad el hotel esta un poco descuidado, el internet limitado, la tele se veía mal, agua caliente con poca presión y aire acondicionado sin control de temperatura. La verdad tome la opción por estar cerca de el lugar donde iba trabajar, esa fue mi razón. Lo rescatable fue el desayuno, variado y en cantidad aceptable, los meseros muy amables. Estuve 3 días y como subía por las escaleras en el pasillo se fueron acumulando platos del servicio al cuarto, hubo un plato con un pan blanco que estuvo los tres días...subía por las escaleras porque era en el primer piso mi habitación y el elevador tardaba mucho, solo había uno en servicio. Creo que por la marca deben de poner un poco mas de atención en las habitaciones.",3
391,"Fui con unos compañeros al restaurante el ""pueblito""me agrado la recomendacion ke me izo UN compañero sobres el buffet que tenia bariedad y precios accesibles.mas que nada quisiera recalcar que necesitan resurtirlo mas segido ya que si tienes gran cantidad de clientes.mas que nada el buen servicio de UN buen mesero llamado Christian praga siempre atento a todo lo que se le pide y su ajilidez es muy buena en la manera que si pides UN agua te la tele muy pronto en cuanto se la pidas ya que le pedi unas tortillas a UN mesero y nunca las trajo por lo tanto recomiendo el restaurante por el servicio de Christian. Gracias",4
392,"Me dieron una habitación no sucia, sino asquerosa. En el piso habia uñas, restos de papitas y aluminio de cerveza. Lo que me sorprendió fue que las camas estaban hechas, o sea que servicio de limpieza ya habia pasado por ahí y aun asi me entregaron asi el cuarto. La alfombra realmente sucia. Después de ver eso que confianza tienes de acostarte en esas sábanas, quien sabe si las cambian o las limpian bien. No lo recominedo para nada y menos comparado con el precio! Hay mejores lugares, mas baratos y sobretodo...más limpios! No se dejen engañar por las fotos, eso fue hace años. Nada se ve así. En cuanto la atención del personal de recepción fue muy buena, eso no le quita la mala experiencia.",1
393,"Buena atención, el hotel tiene buenas instalaciones, nos recibió Raúl y muy atento, mencionándonos los servicios con los que cuenta el hotel, muy limpio por dentro y el desayuno excelente, lo recomiendo",5
394,"Excelente servicio, en especial de Raul el recepcionista. El desayuno muy buenooo, exquisitoo sazon. Sin duda me volveria a hospedar en este hotel, pues ademas por la ubicacion en la que se encuentra te permite trasladarte de un lugar a otro de manera rapida.",5
395,"Excelente trato y servicio del recepcionista RAUL :) el hotel esta muy bien ubicado en el centro, cerca se encuentra una taqueria muy buena por si llegas de madrugada y con hambre y por supuesto el hotel cuenta con restaurante en el cual ofrecen bufete muy bueno super recomendadicimo!!",5
396,"Mi vuelo llegó muy noche a Monterrey y lo único que quería era descansar. Lamentablemente cuando llegué a la habitación lo primero que vi fue una mancha grande de humedad en la alfombra del cuarto, inmediatamente revise las camas porque escogí este hotel debido a que las fotografías que mostraban se veían muy limpias y además de esto estás hablando de una cadena como Hoteles Misión que fue la razón por la que decidí hospedarme aquí. Sobra decir que las cubrecamas estaban sucias manchadas de tierra tenían como manchas de agua que se vea secado las fundas estaban sucias Honestamente decepcionada y sin tener opción a poderme cambiar porque ya era medianoche. Al día siguiente hablé con la camarista y le pedí que me cambiara todas las colchas sábanas fundas y que también me buscara",1
397,"Muy buena la comida con un sazón de hecho en casa, con una buena variedad de comidas y un rico pan de dulce. Buen ambiente con música en vivo. El servicio fue excelente, muy atento el mesero Alexis Jair.",5
398,"No fuí específicamente huésped, pero fuí al restaurante ''Del pueblito'', y tienen un muy rico buffet, variado y de buen sabor. El ambiente es bastante agradable, y limpio. Sin duda, es un muy buen lugar para un desayuno. Lo más apreciable del lugar (como en muy pocos) fue la atención de un mesero llamado Christian, quien siempre está al pendiente de lo que se necesite, es muy animoso e inmensamente servicial. Reconocimiento para ese buen servicio, que no se encuentra en cualquier parte. Definitivamente vuelvo.",5
399,"Excelente comida !! Me encanto él sazón , él trato súper amable de todo él personal 😊 felicitaciones a la mesera Alexia Lizbeth que nos atendió de maravilla , 100% recomendable, nos vemos en nuestra siguiente visita 😉😉😉",5
400,"Buena atención por parte de la srta Esmeralda la supervisora, es muy atenta y alegre Excelente atención a todos el personal del hotel misión Se vive una buena atención y alegría por Todo Regreso pronto. Saludos",5
401,Buena atencion sobre todo la srta Esmerada la supervisora que nos ayudo en todo. Recepcion muy amable. Todaz Regresare. Pronto La limpieza. Genial Bonito todo Excelente. Todo en orden. El personal todos atentos,5
402,me recomendaron el buffet y la verdad muy rico todo y exelente atencion del personal gracias al mesero tirso por hacerme sentir como en casa la verdad muy recomendable buen ambiente familiar regresare un 10 para su restaurante,5
403,"Primera vez que vengo y desde que entre me gusto la atención del personal, especialmente del mesero Manuel. la comida variada y fresca, sabrosa. Áreas limpias en restaurante y sanitarios, buen ambiente y linda decoracion. Buenos precios y espacios amplios y cómodos.",5
404,"Me gustó la ubicacion centrica, las habitaciones amplias y limpias. El restaurant la comida muy sabrosa. Buenos precios. El servicio muy amable del mesero Horacio. El bufet muy completo con fruta, bebidas, almuerzo caliente, etc.",5
405,"Esta muy rico el buffet en el hotel, precio accesible,alimentos frescos, todo está caliente, el jugo de naranja es natural, con excelente atención de sus empleados en especial el mesero Manuel, agradezco su atención!",3
406,"El buffet es delicioso! Muy variado aunque al visitar Monterrey esperaba comer algo de machaca en el desayuno, fuera de eso está muy rico. Excelente servicio de nuestro mesero Horacio! Y del personal de cocina que se preocupan por que lo que te estés sirviendo esté fresco y calientito!",4
407,"Muuuuy bueeeeen serviciooooo todo muy rico y de buen gusto los meseros nos trataron muy bieeeeeen, muy limpio y la comida muy ricaaaaaa un ambiente familiar agradable super bien muuuuuuuy recomendable y el excelente servicio de los meseros Manuel,Horacio y Freiri",5
408,"Muy buen servicio y amibilidad del mesero el sabor de del desayuno.. Y la variedad de los amilentos...asi cmo el sitio la gente y su personla muy agradable la visita en mision monterrey excelente servicio de los meseros Horacio,Manuel y Freiri",5
409,"En restaurante Horacio, Tirzo y Alejandra me han hecho sentir como en casa. la presentación y el sabor de los alimento es muy rico y variado. Recomendable 100% para cualquier visita a demás esta a unos pasos de la Macro plaza excelente la ubicación",5
410,"Los cuartos y los pasillos muy sucios y sin mantenimiento. No parece un hotel Mision. Este es un hotel viejo huele mal, alfombras manchadas, con mal servicio y mal administrado. Pobres empleados deben sentirse avergonzados de trabajar ahí. Una lastima!",1
411,"Solo visité el restaurante, la atención, amabilidad y el servicio del personal ha sido excelente, sobre todo como me atendió la señorita Alejandra Mejorado, con mucha amabilidad, 100% recomendable el restaurante, muy buena la comida y a parte, el costo es muy accesible.",4
412,Señorita quede maravillada con la atención del joven jesus uvalle persona encantadora y servicial me ayudó muchísimo en el hotel mision lo llevaré por siempre en mi corazón muy agradecida los quiero 🙏🙏🙏😘😘😘 de Colombia con cariño amayda,5
413,"Me hospedo por cuestion laboral, y agradezco la atencion del personal en su totalidad, en especial a las Sra. Lucy del piso 8 que estuvo siempre al pendiente y con una amabilidad notable. En horabuena.",5
414,"Me hospede por motivos de trabajo durante 17 días en el hotel, tiempo en el cual disfrute de mi estancia. El personal de recepción fue muy amable, asi como el buen servicio en el restaurante incluyendo al personal (Alejandra, Freiri, Tirso y Manuel), también el servicio de limpieza fue bueno. Me llevo muy buena opinion del hotel y espero pronto regresar.",5
415,"Excelente Servicio en general. En especial en Recepción la Srita. Veronica, muy amable y servicial, siempre con una excelente actitud. Yo he permanecido en el hotel hasta por 2 meses, y de verdad te hacen sentir en ""Casa"", muchas felicidades!!!",5
416,"Tuve un viaje de trabajo por mas de dos semanas, toda la gente fue super linda, la camarista Graciela se porto increíble, los chicos de restaurant también (todo el equipo nos consintió) y ni hablar de Maribel, la chica de recepción, se porto super linda asesorandonos a donde ir en nuestro tiempo libre, muy servicial!! yo la buscaba para que me ayudara en algunas dudas, es muy buena recepcionista! te ayuda en todooo!! definitivamente volvería a Monterrey y me volvería a hospedar en ese hotel!!",5
417,"Hace un tiempo visite Monterrey por cuestiones de trabajo y me hospede en este hotel, la verdad esta muy bien ubicado, tiene una atención excelente por parte del personal de todo el hotel en especial por las señoritas de recepción que son muy amables y atentas, también aprovechó para felicitar a la señorita Maribel por el empeño a su trabajo y atencion",5
418,"El pasado viernes 18 de enero, nos alojamos en este hotel, las instalaciones nos parecieron bien, cómodo, y agradable nuestra habitación en donde nos alojamos mi esposo, mi hijo y yo, únicamente por una noche, al llegar al hotel, el personal de recepción bastante cortante y nada amable, toleramos y tratamos de llevar la fiesta en paz, te dan una notificación y firmas que estás de acuerdo con una multa de 3000 pesos si llegas a fumar dentro de las instalaciones, pero lo dicen tan rápido que tuve que solicitar si me repetía la información, a la recepcionista, quien se hizo la tonta y me ignoró, le pedí indicaciones para trasladarme a un hospital en virtud de que un familiar estaba internado ahí y solo se limitó a decirme que estaba muy lejos, además de grosera Insensible, en fin,",2
419,"Excelente ubicación, las habitaciones y sus blancos siempre en perfecto estado, la comida del restaurante excelente, pero lo mejor es el buen trato de la Srta Maribel y la Srta. Verónica que con su atención y amabilidad siempre invitan a regresar.",5
420,"Muy buena atención y aclaración de dudas por parte de la señorita Verónica castillo, atenta y amable en cuestión laborable. Ideal para descansar muy buenas habitaciónes, limpieza, ordenadas. Buena comida de parte del restaurante,variedad en comidas",5
421,Este lugar maravillosa me deja siempre muy impresionante por la formar de recibir a su clientes si me refiero personalmente a una de su empleada que se llama REYNA recepcionista me trato de una forma muy agradable sonriente y atento apresar del cansancio de mi viaje siempre que visito su cuidad estoy con su hogar muchas gracias por la attention....,4
422,"Perfecta ubicación en el centro de la ciudad, el servicio que brinda el personal así como las instalaciones hacen que la estancia en el hotel sea placentera en todo momento. La atención de la srta Estefany Garza fue excelente.",5
