,Comentario,Score
502,"Excelente servicio, todos muy amables y muy atentos, muy recomendable el restaurant, incluso el servicio de paseos turísticos, se ve que están bien coordinados y atentos a las necesidades de sus clientes.",5
503,"Excelente servicio excelente comida!!! La fruta y los platillos,el buffete todobuen.....Gracias al mesero Rolando por sus atenciones!! Vinimos de Tabasco.. lo recomendamos ampliamente aunque no se hospeden ahí!! Para los fines de semana!!",5
504,"La gente muy amable, en especial Mario Freiri que nos atendió en el restaurante, un chico muy atento y servicial, los alimentos muy ricos y frescos; en general la atención del hotel fue excelente. Felicidades!!!",5
505,"De los hoteles de la zona me pareció el mejor por la comodidad de las habitaciones, la atención en el restaurante bastante aceptable, por ubicación y cercanía con avenidas importantes, de igual forma salir caminando encuentras a pocos metros todos los servicios.",4
506,"Esta muy cómodo justo para salir de paseo, y que esta en el centro de la ciudad donde para iniciar la aventura en Monterrey en el paseo Santa Lucia y la Macro plaza solo a 15 minutos a pie. Las habitaciones son cómodas, pequeñas pero bien. El personal es muy atento, los chicos de Recepción, la Srita Verónica. En el restaurante todos muy atentos y la comida rica. En general yo si podría recomendarlo.",4
507,"Hice mi reservación por Booking.com pero el personal de recepción no podía encontrarla, la chica de recepción se mostró indiferente, y cero ganas de servir; no me proporcionaron información del desayuno. Definitivamente no regresaría.",2
508,"Viajamos por placer y desallunamos ahi algunas veces tienen muy buen servicio , personal atento y amable , en cuestión a la comida excelente sazón! , muy limpio el lugar y agradable el ambiente , muy recomendado!",5
509,"Es una porqueria estuve en el abri la cuenta con una tarjeta de credito empresarial y a cada rato hablaban para cobrar se les dijo que se pagaba al final de la estancia, y siguen fregando hasta altas horas de la noche la verdad es una porqueria de hotel le doy pesimo porque no hay menos. Para recomendarlo he!!!!!!!",1
510,"Hice reservación por internet en este hotel para el pasado fin de semana y sobre vendieron habitaciones , no fui el único caso ya que en el lobby había fácil 20 personas en el mismo caso y la gerente no tuvo solución , solo un no es su culpa! No conocí instalaciones , está ubicado en una zona fea y peligrosa al salir ... Evítenlo !",1
511,"Lo más destacable del lugar es la atención del personal y el desayuno buffet, que es verdaderamente delicioso. Fui con un grupo de 18 personas y el registro de entrada no tuvo mayor problemas, nos entregaron algunas habitaciones para poder dejar el equipaje y antes de la hora de check in, ya nos las habían entregado todas. Disfrutamos nuestra estadía y hay mucho que ver cerca del hotel, lo recomendamos ampliamente.",5
512,"Mala experiencia me ha dejado este hotel. Ya había leído malos comentarios antes de reservar pero pensé que las personas exageraban. Mis principales quejas son que pague una cuota más cara para poder hacer uso del estacionamiento y ni cuenta se daban de quien usaba el estacionamiento. El piso donde me hospede presentaba un olor a humedad muy fuerte, así como la habitación. Y por último no fueron capaces de proporcionarme una plancha porque según me dijo el de recepción las tenían todas prestadas, por lo menos deberían considerar tener para cada habitación y aconsejaría aparte tener caja fuerte en las habitaciones.",2
513,"Me hospede en ese hotel, el peor de todos los hoteles misión de México, los baños super sucios, las habitaciones sucias y la atención de recepción en turno matutino nefasto, mala atención mal servicio.",2
514,"Un trato excelente por parte de las gerentes Lucy y Roxana, además de que la señorita Maribel Cobos nos atendió con mucha amabilidad, respeto y en buen tiempo; lo que más me gustó es el personal que es muy amigable, así como el personal del restaurante es grandioso. Regresaré en cuanto pueda",5
515,"El servicio es muy bueno en este hotel La atención de la señorita de recepción de nombre Maribel Cobos es excelente Y el trato y servicio del restaurante es muy bueno, altamente recomendable para visitar",5
516,"Un hotel bastante deteriorado viejo con olor a humedad, camas no muy cómodas, no es tan malo pero el precio no corresponde a lo que recibes, esta cerca del CAS para las fotos de tu visa, definitivamente no parece un hotel de la cadena mision",2
517,"Estuve de martes a viernes en este hotel Misión del Centro en Monterrey, y las instalaciones están limpias. La habitación cómoda, y algo muy importante: el baño limpio y cómodo. No tuve problemas con Internet y el precio fue barato, considerando que por la misma cantidad otros del centro tenían cucarachas. No encontré yo insectos. Lo recomiendo sobre todo para mis compañeros de la Secretaría de Gobernación que frecuentemente vamos por allá. Saludos.",5
518,"Para empezar, yo requería factura y llevo una semana llamando por esta y no me la han generado. Nadie me da solucion, me han colgado cuando llamo, he pedido hablar con el gerente y jamas lo he logrado. He llamado unas 25 veces en la ultima semana y me dejan en espera de hasta 20 min cada vez, la gente de recepción grosera y todo mundo dice que lo de la factura no es culpa de ellos. En cuando al hotel debo decir que llegue alrededor de las 4:00 pm y tuve que hacer fila de por lo menos 25 minutos, aun no entiendo porque. Al llegar al piso donde tenia mi habitacion el pasillo olia a humedad, ya en la habitacion la alfombra tenia varias manchas, el baño demasiado austero para el costo de la habitacion, un contacto que estaba cerca de la mesa no servia, el teléfono de la habitacion",1
519,"Me lleve una total decepción con este hotel de la cadena misión, es un lugar viejo, sucio, con mobiliario pésimo, insectos. El día que me entregaron mi habitación tenia un fuerte olor a humedad ( pienso que se debió a que las alfombras son desde que se inauguró este hotel), y por si fuera poco según la habitación estaba lista y el escusado tenia rastros de orines por todos lados. Pedí cambio de habitación ante lo sucedido y no tuvieron otra opción que entregarme otra. Las camas son bastante incomodas y por el precio que te cobran ni siquiera una cafetera en el cuarto. Lo único rescatable es su ubicación. No lo recomendaría para nada.",2
520,"Decepcionante el deterioro del hotel, especialmente la habitación que nos asignaron. Parece que no han remodelado desde finales de los ochentas. Las toallas y sábanas son harapos y sumamente percudidas. La recepcionista necesita mejorar su actitud ya que parecía molesta, no tuvo ni la atención de mirarnos ni de decir una sola palabra amable. Definitivamente, creo el hotel debería anunciarse como de dos-tres estrellas.",1
521,"Lo visité en enwro del 2015, toda nuestra estancia estuvo perfecta, la habitación amplia, buena conexion a internet y sin ningún inconveniente, la chica de recepción nos ayudó con nuestro web check in con la aerolinea y amablemente nos imprimió nuestros pases de abordar. Solo como recomendación, tener mas opciones en el buffet, asi como opciones veganas o vegetarias.",5
522,"Una total decepción el hotel, para ser una misión deja mucho que desear, las habitaciones viejas, sucias, las toallas grises de viejas, el personal amable pero simplemente dicen si disculpe esta viejo y no tenemos personal a las 8 de la noche para limpiar su habitación",1
523,"Definitivamente no me gusta este hotel, llegue y el inodoro estaba obstruido y el aire acondicionado no funcionaba, el personal de recepción no resuelve las cosas, me cambiaron de habitación y el aire acondicionado funciona de manera ineficiente, no regreso a ese hotel por nada",2
524,"Un hotel muy bien ubicado, cerca de la macro plaza, el personal muy atento, y unas almohadas comodisimas, en verdad recomendable. El personal del restaurante muy atento y el buffet variado, te ofrecen tours en el mismo hotel, se recomiendan todos ellos, como las Grutas de Garcia y Parque Fundidora.",4
525,La cadena de hoteles Misión se ha ganado un reconocido prestigio por ofrecer hoteles de buena calidad en zonas turísticas de ciudades coloniales o poblaciones con algún interés histórico. El hotel Misión de Monterrey no tiene ese sello. Se ubica en un edificio que no es histórico ni elegante pero que se encuentra muy bien situado para la gente de negocios y para los turistas que desean recorrer el centro histórico de la Sultana del Norte. Al edificio le hace falta la calidad de los hoteles Misión pero está haciendo un esfuerzo por mejorar sus instalaciones. Le sugiero pedir una habitación remodelada. Ofrece un desayuno buffet de buena calidad.,3
526,"Es cierto que como todos los hoteles tiene sus defectos, la verdad no puedo comentar sobre todo el personal ya que solo tuve contacto con la chica de recepción, nunca tuve la necesidad de interactuar con alguien más, leo que se quejan muchos sobre plancha y secadora, es verdad que no las hay en habitación pero en recepción te las facilitan, las habitaciones son acorde a un hotel, todas son estándar y son idénticas en tamaño a la mayoría de los hoteles en que me he hospedado, no se porque la gente siempre se queja de tamaños, no es una casa, no es un departamento y no es una suite de 2 cuartos, sala y cocineta, es una habitación cómoda para dormir, muchos hoteles en europa quisieran ese espacio. Según me informaron cuenta con piscina, la verdad nunca la vi ya que me dedique a lo",4
527,"es un hotel viejo en remodelación, pero eso no quitaría la atención y calidad del servicio, la limpieza es muy mala, te dejan toallas cuando quieren, el wifi es el mas malo que pueda existir, nos respetan y saben hacer su trabajo de remodelación. DOMINGO 8 AM ALBAÑILES TRABAJANDO EN EL PASILLO JUNTO A TU PUERTA ¡¡¡¡¡¡ habitación muy pequeñas sin ventilación, aire viejos y con mucho ruido.",2
528,"Llegue muy temprano al hotel conozco las políticas de los hoteles misión pues continuamente me hospedo en varias ciudades, se que la entrada es a las 3 de la tarde sin embargo llegue temprano para confirmar mi reservación y de paso pedirles de favor que me pudieran guardar el equipaje en lo que desayunaba y hacia unas diligencias, para empezar el recepcionista de mala gana me atendio, le pedi que me guardara el equipaje y se negó rotundamente pues me comento que solo podía hacerlo una vez que estuviera hospedado,¿¿¿???, despues le pedi que me confirmara mi reservacion y me dijo que solo podía hacerlo hasta las 3 de la tarde a lo que le recordé que me hospedaria hasta esa hora, únicamente requería que me confirmara que efectivamente mi reservación estaba hecha, como no me quiso",1
529,las verdad se los recomiendo es muy cómoda pasaran una estancia cálida y placentera lo mas bueno es también el restaurante el bufete por la mañana es delicioso.... el personal es atento es un buen lugar para pasar una estancia familiar,4
530,"Las habitaciones huelen mal, focos fundidos, internet malo, no hay secadora de cabello, no es 4 estrellas. Me asignaron habitacion en el piso 6 y segun entedi eras las mejores, no quiero saber como son las otras",1
531,"Fachada que promete habitaciones que deprimen... deja mucho que desear, hab. Muy chica, sin tocador, sin plancha, solamente 6 ganchos para colgar tu ropa, esos si, la comida está bien y buen servicio de los meseros, pero desgraciadamente por más buen servicio que tenga no harán que regrese a ese hotel.... Monterrey es de lo mejor....",3
532,"Escogi un hotel en el centro, ya que es muy conveniente si vas a tramitar visa Americana, a solo 2 cuadras y media del CAS, reserve en linea, el check in fue rapido y sin problema, el hotel ya tiene sus anios, las habitaciones son pequenas, suficiente para llegar a dormir, tuve un ligero detalle sin importancia y Daniel (la persona de recepcion) estuvo muy al pendiente de resolver la situacion, incluso el toma decisiones sabiendo que es por tener contento al huesped, al final decidimos permanecer en la misma habitacion, le agradeci mucho a Daniel su espiritu de servicio, piensa como el dueno. Definitivamente volvere.",4
533,Si tu intención es estar a una distancia caminable de la Marcoplaza y del Barrio Antiguo de Monterrey a un costo razonable sin altas expectativas de confort y servicio ésta puedes ser una muy buena opción. El hotel cuenta con estacionamiento e internet gratis en la habitación. Sus habitaciones son bastante austeras en cuanto a decoración y confort aunque las instalaciones son algo viejas. No tienes caja de seguridad en la habitación y el control de aire acondicionado sólo te permite encender o apagar (no te permite regular la temperatura o la velocidad del ventilador). Los colchones y almohadas me parecieron suficientemente cómodos. El nivel de ruido en la habitación del tercer piso con la ventana cerrada y el A/C prendido te permite un buen descanso. La primera sorpresa no,3
534,"Las habitaciones sencillas son muy pequeñas, sin embargo la Suite esta bastante amplia y cómoda, en cuanto a la ubicación es perfecta porque está a dos calles del metro! El desayuno es bueno aunque creo q pueden mejorar!! Y remodelar un poco el hotel.",4
535,"El servicio es deficiente para lo que se esperaría de un hotel que se supone es de cuatro estrellas. No me parece lógico tener que bajar un piso para usar el elevador, porque el botón del piso donde estoy no sirve. Tampoco me parece decente tener que escuchar la discusión de una pareja a la una de la mañana, señal de que las paredes son demasiado delgadas. Eso, sin contar que cuando llamé para quejarme, en la recepción simplemente se comportaron como si les importara poco y tardaron en tomar medidas. Su desayuno tampoco es una maravilla. En síntesis, no recomiendo este hotel para nada.",2
536,"El hotel tiene una ubicación estratégica si vas de paseo o por compromisos escolares o de trabajo, esta cerca de la estación del metro y al rededor hay una infinidad de negocios, cerca de la macropalza, la relación costo - beneficio es muy buena, los cuartos son un poco pequeños pero limpios y agradables, el personal es muy amable.",5
537,"El hotel se encuentra en una excelente ubicación. Cuenta con disponibilidad en el servicio de taxi las 24 horas del día, habitaciones y baños amplios. El servicio de limpieza excelente. Con respecto al restuarant, la comida deliciosa, excelente trato y servicio. Cumplio con mis expectativas. Lo recomiendo al 100",5
538,"El hotel está en excelente ubicación, con taxi las 24 horas del día, la limpieza impera en todos los rincones, la atención fue personalizada, las habitaciones muy completas y con excelente servicio de limpieza, la tarifa no se diga fue muy accesible para las 20 personas que me acompañaron y fue una gran noche de negocios, es la tercera ovación en que nos sopesamos en menos de un año y lo volveríamos a hacer",5
539,"Las habitaciones y los baños tienen el tamaño adecuado, si bien el hotel tiene sus años el personal se esmera en proporcionar un buen servicio, todo está muy limpio y el desayuno bufete cumple muy bien con los alimentos típicos de Monterrey. En mi opinión la diferencia con otros hoteles la hace definitivamente la atención de todo su personal.",5
540,"Muy buen trato del personal,lo recomiendo muy ampliamente, además esta en el mero centro de Monterrey por lo que cualquier cosa que necesites la tienes prácticamnte a la mano, sin lugar una excelente opción para viajes de negocio en Monterrey",5
541,"Excelente calidad en el servicio al cliente, excelente ubicación para pasar unas vacaciones en la ciudad de Monterrey, altamente recomendable para cualquier tipo de visita. Siempre me hospedo en hotel mision por sus atenciones.",5
542,"Me recibió muy bien el personal de recepción, excelente ubicación en el centro de la ciudad, el desayuno incluido en la tarifa, la suite muy amplia y limpia, el primer tramite para solicitar mi visa esta a 2 cuadras",5
543,"Muy buena ubicación, a poca distancia de la macroplaza para ir a festejar el triunfo de Tigres. Las habitaciones tienen buen espacio. El servicio en restaurante ha mejorado mucho comparado con mis visitas anteriores, en general vi cambios positivos que me dejan con un buen sabor de boca. Gracias por su hospitalidad.",4
544,"Me encantó el trató de Atziri yv su v equipo para reservar, trasladarme y servicios que o ocupamos, no tuve ningún contratiempo en mis actividades gracias a las facilidades brindadas. Altamente recomendable.",5
545,"Buen hotel perfectamente ubicado en el centro de la ciudad, las habitaciones son amplias y limpias. El buffet del desayuno es bueno y variado, además de que la atención que dan es perfecta. Lo recomiendo, regresaría a hospedarme en mi siguiente viaje.",4
546,"Fue una gran experiencia, excelente servicio, hospitalidad de primera , muy bonito el hotel y sus habitaciones, el personal muy gentil y profesional visite a grandes amigos Felicidades! El de Macallen esta tambien SUPER se los recomiendo,",5
547,"Quiero recomendar AMPLIAMENTE este hotel, la atención de recepción, el servicio de limpieza, las instalaciones, que por cierto han estado en remodelación, (lo se porque no es la primera vez que me hospedo aquí)! Aparte los desayunos muy ricos con mucha variedad! La ubicacion del hotel excelente!!!!!",5
548,"Mi pareja y yo queríamos algo diferente para el inicio del año, Este hotel fue nuestro cómplice en la aventura. Las habitaciones son silenciosas y limpias, para la cena romántica en el restaurante con una comida deliciosa y con muy buen servicio, el ambiente y con la mejor ubicación para diversión, compras y paseo.",5
549,"Desde la llegada la atención fue muy amable, fui con mi familia a pasar fin de año a monterrey y no me equivoque en la elección. Nos sentimos muy a gusto y protegidos. Las habitaciones están muy cómodas y confortables, siempre limpias. La comida del restaurante exquisita y con una atención que te hace sentir como en casa.",5
550,Personal de recepción PÉSIMO sin buen trato a los cliente Calidad precio/comodidad desastroso después del mal servicio que recibimos La calefacción no sirve aunque el personal de mantenimiento indicó que después de 30 minutos funcionaría bien y no sucedió No hubo agua caliente para bañarse además de que la llave para accionar la regadera estaba desprendida e imposible de hacer que funcionara Nos prestaron otra habitación PERO HO HABÍA AGUA CALIENTE!!!!!!! En el desayuno los huevos frits que sirvieron estaban crudos,1
551,La relación precio calidad es buena. Está muy bien ubicado. El hotel se ve antiguo pero le han invertido al mantenimiento. Habitaciones comodas. Desayuno bufete es muy rico. El unico detalle fue la recepcionista y personal de recepción poco amable y con mala cara.,4
552,"es un hotel ya viejo que le falta dar un toque de modernismo, la habitación ya un poco vieja pero funcional, la cama muy comoda en la habitación que me toco, el personal me dio mucho a desear ya que no le dan ese toque de calidez, el personal de recepción muy tosco nada amables, de igual forma en restaurante el personal muy lento y los días que estuve ni siquieran se acercaban a ti para ofrecerte una bebida, como el desayuno era bufet hasta que te acercabas a barra ya te atendían",4
553,"El hotel es ¡¡¡¡¡HORRIBLE!!!!! en todos los sentidos, empezando con la atención del personal de recepción, me atendió una chica con un genio que deja mucho que desear que contestaba mal para cualquier pregunta que se le hiciera, los elevadores son de hace tres décadas y cuando te subes se mueve como si fuera a caerse, los botones no sirven y no tiene ventilación, los pasillos de los cuartos huelen demasiado a desodorante de cuartos, las habitaciones están muy mal distribuidas y huelen a una humedad penetrante, las alfombras están manchadas por todos lados y las sabanas de las camas hueles a perfume, los baños están desgastados y mal cuidados, el aire acondicionado no enfriaba y el internet era ¡¡PESIMO!!, no podía ni conectarme, es un lugar donde jamás pensaré quedarme",1
554,"Habia tenido la oportunidad de hopedarte en otros Hoteles de esta cadena con opiniones muy favorables de cada uno de ellos, hasta que me deje llevar por la experiencia en esta cadena y esperando la misma calidad. Pero sorpresa este hotel deja mucho que desear (Habitación con olores raros, las sabanas olian mal, mala atención y comida en el Restaurant fuera del desayuno. solo la atención de recepción por las mañanas es buena, el turno de la tarde deja mucho que desear. En resumen no me volveria a hospedar en este hotel y no lo recomiendo para nada.",1
555,"Estuve solamente dos noches y NUNCA funcionó el WIFI, las instalaciones son viejas, huele a humedad, la llave dejó de funcionar, la ubicación está en una zona muy fea y el costo es muy parecido a otros hoteles con mejor ubicación. Intentamos cenar en el restaurante un sándwich y un plato de fruta que nunca nos llevaron (Más de 30 minutos) Definitivamente no regreso.",3
556,"Lugar tarnquilo y muy centrico, buen desayuno y amabilidad por parte del personal. Lo único que le mejoraría son los muebles de baño y la regadera porque se ven descuidados y un poco de decoracion en la habitacion porque se ve muy sobria.",4
557,"El hotel es muy viejo, todas las instalaciones están oxidadas y necesitan mantenimiento. La manija de la puerta principal estaba rota y me hacía sentir insegura por lo que pedí un cambio de habitación y me lo negaron argumentando que no había disponibilidad. Los blancos estaban percudidos y las sabanas no eran del tamaño de la cama por lo que optaron por poner sabanas individuales. El agua nunca salió caliente y se escuchan todas las puertas y regaderas de las habitaciones aledañas. La relación costo -beneficio no es congruente. Pagué más de 1000 pesos por una noche es un hotel de pésima calidad.",1
558,"Me arrepiendo de haber elegido este hotel, en esta ocasion fui de trabajo imposible aceeso a internet desde el piso 6 , viejo y sucio el hotel, el baño tenia desperfectos, la atencion en la recepción deja mucho que desear, hiceron mal el cargo del hospedaje en mi tarjeta de credito, y me dijeron que yo tenia que hablar para resolver el problema mas adelante y que me depositarian la diferencia, sigo esperando.",2
559,"pésimo el servicio por parte de restaurante, la comida estaba fea salvo algunas deberían de tener mas variedad de comida y de buffet aparte de que tienen la huevera ponen insertos en el buffet con mas huevo osea!!!! ahí creo que el chef no se esta haciendo bien su trabajo en las facturas se tardan mucho en darlas y tienes que estar atrás de ellos para que te las manden y una mesera que traía brackets con una muy mala cara junto con una cocinera que estaban platicando. en recepcion muy bien por parte de la srita. brenda me hospedo ahí pero jamas volveré a restaurante siempre y cuando cambien al personal",1
560,"Habitaciones demasiado calurosas, no se puede bajar mas la temperatura, fuga de agua en el baño, no cambian las sabanas diario, las facturas del restaurante no las envian hasta que les recuerdas nuevamente.",3
561,"Mi regadera no funcionaba, llamé a recepción 2 veces y no subieron, tuve que bajar directamente ya molesta a decirlo. No me dieron la habitación que me mostraban en mi reserva, me aseguraron que esa era y no me dieron esa. Pésimo valor para el precio, el hotel Antaris valle es un hotel mil veces mejor y cobra lo mismo. El hotel de en frente a ese está a mitad de precio y ofrecen cosas mucho mejores, atenciópn excelente, habitaciones lindas y redecoradas... ME ARREPIENTO TOTALMENTE Y HASTA EL ULTIMO DIA DE MI VIDA.",2
562,"Mi queja general es el estado de las instalaciones ya les hace falta mantenimiento en general. El tamaño del baño es muy adecuado sin embargo el espacio de la regadera extremadamente pequeño, el tubo que sostiene la cortina de la regadera oxidado al igual que los botes de basura, el espacio para poner el shampoo y el jabón dentro de la regadera se nota percudido. Algunos de los apagadores de luz no servían. El piso en general se ve desgastado. El aire acondicionado no tiene regulador de temperatura. Faltan tomas de corriente ya que estuve trabajando durante la noche y tuve que incomodar con la luz a mi familia ya que al tener una sola toma de corriente o conectaba la laptop o conectaba la lámpara. El espacio del closet desgastado tanto que no me anime a colocar mis pertenencias",3
563,"Estuve hospedado el 26 de junio del presente y al llegar a la recepción a las 2 de la tarde el recepcionista dijo que iba a hacer lo posible por tener lista la habitación ,a pesar de que estaba ya reservada, el elevador muy comodo,la habitación y baño muy amplios, solo fallas en el aparato de aire acondicionado por que tenia una gotera y hubo que hablar 4 veces a recepción para que lo atendieran,eso en un lapso de 4 horas,lo demás muy bien,solo falta mejorar la atención en recepción.",4
564,"Pidan las Suite de los cuartos 400-600. Tengo 4años llendo al hotel mision con mi pareja para pasar un rato agusto. El lugar es bonito, a buen precio y sobre todo las habitaciones estan muy amplias, comodas, mezclando historia y modernidad en las Suite. Una muy buena recomendacion para hospedarse un fin de semana y en el lugar mas centrico de todos.",5
